question,answer,contexts,ground_truth,file_name
"So, if you can give detail which all areas we are seeing cost dictation? ","The main areas where cost reduction has been observed are in pulp prices, caustic prices, and coal prices. These input prices have decreased significantly compared to the previous year and the last quarter.","['August 10, 2023\n\nModerator: Thank you very much. We will now begin the question-and-answer session. The first question is from the line of Sumangal Nevatia from Kotak Securities. Please go ahead.\n\nSumangal Nevatia: My first question is on the viscose business. So, clearly costs are dictating. So, if you can give detail which all areas we are seeing cost dictation? And also, in the coming quarters as we can see prices are a bit of under pressure. What all some outlook on the cost for the coming quarters if you could share?', 'Harikrishna Agarwal: So, on the first side, obviously, the main cost items where we have seen reduction are pulp prices, caustic prices and coal prices. So, all the important input prices have come down compared to last year significantly and also compared to the last quarter. So, that is a very positive trend. Looks like the input prices do not have much further room to go down, but we have to see. It all depends on the macro level situation and especially in China. So, China now is going through very difficult phase. Today newspapers everybody read that China is going through deflationary pressure. So, we have to see how the government and the Chinese economy perform in the coming months and that will determine the input prices all over the world.', ""| |So, I think that's what it is, and I think the material difference that we have on our cost structure is that today on an expanded base, 14% of our power mix is on renewable side, which is significantly lower in cost compared to the current grid cost or the thermal power plant cost. And also, on our as Mr. Agarwal was talking, the coal prices compared, we, I think are now buying. We have done better than the index values of the coal buying. So, our power cost mix is lower than the industry average.|\n|Nirav Jimudia:|So, sir, here if you can share what was our average power cost for Q1? And how much savings we could assume from Q2 onwards? Because last quarter you mentioned that our average power cost was close to ₹7.5 a unit. So, if you can?|"", 'Sumangal Nevatia: So, I mean, as far as the spot rates are concerned for the various cost items, it is already largely reflected in 1Q results when you say there is not much further scope of reduction or there is some further inventory gains and you will see some benefits in the coming quarter?\n\nHarikrishna Agarwal: I think this is fairly reflected already. Yes, small things will keep moving, but that will not be very big.\n\nSumangal Nevatia: And so, the caustic business, sir, given the pressure on prices, coming quarter, should we expect margins also to trend in line with the price weakness or there are some offset available there?\n\nJayant Dua: So, this is Jayant Dua this side. So, we believe that caustic the way it is trending, you are nearly at the end phase of further reduction. There could be marginal changes which are obviously a function of local India movements and how the Indian consumption centre moves, but we believe\n\nPage 6 of 18\n---\n# Grasim Industries Limited\n\nAugust 10, 2023']","So, on the first side, obviously, the main cost items where we have seen reduction are pulp prices, caustic prices and coal prices. So, all the important input prices have come down compared to last year significantly and also compared to the last quarter. So, that is a very positive trend. Looks like the input prices do not have much further room to go down, but we have to see. It all depends on the macro level situation and especially in China. So, China now is going through very difficult phase. Today newspapers everybody read that China is going through deflationary pressure. So, we have to see how the government and the Chinese economy perform in the coming months and that will determine the input prices all over the world.",Grasim Industries.pdf
"for the Paint division, should we expect a large part of our ₹10,000 crore CAPEX to be concluded by FY’25 given that FY’24 also is a very significant CAPEX for the presentation?","Yes, a large part of the ₹10,000 crore CAPEX for the Paint division is expected to be concluded by FY’25.","[""|Prateek Kumar:|And your CAPEX this year your CAPEX spend is in the ₹4,200 crores over ₹2,600 crore which we did for last year. So, remaining is only, I guess, around ₹3,000 crores in this segment. So, all of it is expected to get incurred in FY’25 or some of it is like more like working capital related expenditure, so it can come as an operating kind of CAPEX later in the FY’26 or '27?|\n|---|---|\n|Rakshit Hargave:|So, the overall CAPEX spent till 30th June is ₹3,638 crores. That's the right number. So, I think you are having a different number.|\n|Pavan Jain:|We are talking of cumulative. Your cumulative spend on the paint is ₹3,200 crores. ₹3,600 crores. Yes, and ₹4,283 planned for this year, balance of the ₹10,000 crore which is spent in '25. Some small amount may spill over like the performance guarantees like remains etc. That may go to FY’26, but largely, everything will be spent by FY’25.|"", ""Sumangal Nevatia: So, the peak of CAPEX will be this intensity only in a particular year or coming years FY’25, '26 you see further increasing CAPEX from what we are spending in FY’24?\n\nPavan Jain: So, for the Board approved CAPEX numbers, if you look, this is I think one of the highest spending year, current financial year. For the next financial year, we will have while the pending CAPEX of Paints business for the next financial year, we will have proposals to go to the Board and get Board approval etc. So, for next financial year, it is very difficult to say about the numbers, but as of now, yes, this year looks like CAPEX heavy year.\n\nModerator: Thank you. The next question is from the line of Nirav Jimudia from Anvil Research. Please go ahead."", 'Page 6 of 18\n---\n# Grasim Industries Limited\n\nAugust 10, 2023\n\nthat largely it is more or less near is bottoming out. But yes, the trend as for this particular quarter will be lower as compared to the average of last quarter because the exit of last quarter is what we are seeing today as the new stabilization. So, yes, to your question will there be further margin erosion based on the exit of last quarter, it will be relative to, it will be equivalent to that, but from the average of last quarter, it will be a dip.\n\nSumangal Nevatia: Sir, my second question is with respect to CAPEX, for the Paint division, should we expect a large part of our ₹10,000 crore CAPEX to be concluded by FY’25 given that FY’24 also is a very significant CAPEX for the presentation?\n\nPavan Jain: Yes. So, you can assume that. So, a large part of CAPEX will be done by FY’25.', ""Pavan Jain: Yes. So, you can assume that. So, a large part of CAPEX will be done by FY’25.\n\nSumangal Nevatia: And sir, the B2B ecommerce, there is low CAPEX what we are spending this year, is there any other indirect way of financing in terms of working capital etc., being absorbed in that business?\n\nPavan Jain: No, there is no in that as of now I think and CAPEX is, see, it is not a CAPEX intensive business. We have spent on the technology side, and of course, we will have to continue to spend on technology. So, that is all for CAPEX.\n\nSumangal Nevatia: So, the peak of CAPEX will be this intensity only in a particular year or coming years FY’25, '26 you see further increasing CAPEX from what we are spending in FY’24?""]","Yes. So, you can assume that. So, a large part of CAPEX will be done by FY’25.",Grasim Industries.pdf
"the B2B ecommerce, there is low CAPEX what we are spending this year, is there any other indirect way of financing in terms of working capital etc., being absorbed in that business?","No, there is no other indirect way of financing in terms of working capital being absorbed in the B2B ecommerce business as of now. The business is not considered CAPEX intensive, with current spending focused on technology and potential future spending in the same area.","[""Pavan Jain: Yes. So, you can assume that. So, a large part of CAPEX will be done by FY’25.\n\nSumangal Nevatia: And sir, the B2B ecommerce, there is low CAPEX what we are spending this year, is there any other indirect way of financing in terms of working capital etc., being absorbed in that business?\n\nPavan Jain: No, there is no in that as of now I think and CAPEX is, see, it is not a CAPEX intensive business. We have spent on the technology side, and of course, we will have to continue to spend on technology. So, that is all for CAPEX.\n\nSumangal Nevatia: So, the peak of CAPEX will be this intensity only in a particular year or coming years FY’25, '26 you see further increasing CAPEX from what we are spending in FY’24?"", ""As we are making a large investment in new businesses for the next phase of growth, the net debt as of 30th June '23 stood at ₹3,515 crore. During this quarter, we have also participated in the preferential allotment by Aditya Birla Capital wherein we have invested ₹1,000 crore. Excluding our investment in new businesses and the investment in Aditya Birla Capital, our existing businesses continue to generate free cash flows and we have generated ₹256 crore for the quarter one of FY'24.\n\nThe Board has approved CAPEX spending of ₹5,791 crore in FY'24 including ₹4,283 crore for paints business. During the first quarter, we have spent ₹1,380 crore towards CAPEX.\n\nWe now open the floor for Q&A.\n---\n# Grasim Industries Limited\n\nAugust 10, 2023\n\nModerator: Thank you very much. We will now begin the question-and-answer session. The first question is from the line of Sumangal Nevatia from Kotak Securities. Please go ahead."", ""Sumangal Nevatia: So, the peak of CAPEX will be this intensity only in a particular year or coming years FY’25, '26 you see further increasing CAPEX from what we are spending in FY’24?\n\nPavan Jain: So, for the Board approved CAPEX numbers, if you look, this is I think one of the highest spending year, current financial year. For the next financial year, we will have while the pending CAPEX of Paints business for the next financial year, we will have proposals to go to the Board and get Board approval etc. So, for next financial year, it is very difficult to say about the numbers, but as of now, yes, this year looks like CAPEX heavy year.\n\nModerator: Thank you. The next question is from the line of Nirav Jimudia from Anvil Research. Please go ahead."", ""Pavan Jain: Yes, we will supply the chlorine to them by pipeline, and we will do the operations part.\n\nJayant Dua: Operation management for them as well as the entire CAPEX sales is their responsibility. It does not impact us. So, we are actually protected from the vagaries of the market in this operation.\n\nShyam Sundar Sriram: So, therefore, you will be compensated for the Opex cost essentially.\n\nJayant Dua: We will be compensated for, we will not get into the disclosures of that cost, but will be compensated to the Opex cost plus our management fees, operation management fee.\n\nShyam Sundar Sriram: That's helpful. Sir, are there any more such products in the pipeline? How do we see the evolution here per se?\n\nJayant Dua: So, this is the first one which is being attempted, and I think as we proceed ahead, it will evolve as we go along. Today very difficult to say anything beyond this.""]","No, there is no in that as of now I think and CAPEX is, see, it is not a CAPEX intensive business. We have spent on the technology side, and of course, we will have to continue to spend on technology. So, that is all for CAPEX.",Grasim Industries.pdf
"the peak of CAPEX will be this intensity only in a particular year or coming years FY’25, '26 you see further increasing CAPEX from what we are spending in FY’24?","The peak of CAPEX is expected to be at a high intensity in the current financial year. While it is difficult to predict the exact numbers for the next financial year, it is suggested that a significant portion of the CAPEX will be completed by FY’25. There may be some spill-over into FY’26, but the majority of the CAPEX is anticipated to be spent by FY’25.","[""Sumangal Nevatia: So, the peak of CAPEX will be this intensity only in a particular year or coming years FY’25, '26 you see further increasing CAPEX from what we are spending in FY’24?\n\nPavan Jain: So, for the Board approved CAPEX numbers, if you look, this is I think one of the highest spending year, current financial year. For the next financial year, we will have while the pending CAPEX of Paints business for the next financial year, we will have proposals to go to the Board and get Board approval etc. So, for next financial year, it is very difficult to say about the numbers, but as of now, yes, this year looks like CAPEX heavy year.\n\nModerator: Thank you. The next question is from the line of Nirav Jimudia from Anvil Research. Please go ahead."", ""Pavan Jain: Yes. So, you can assume that. So, a large part of CAPEX will be done by FY’25.\n\nSumangal Nevatia: And sir, the B2B ecommerce, there is low CAPEX what we are spending this year, is there any other indirect way of financing in terms of working capital etc., being absorbed in that business?\n\nPavan Jain: No, there is no in that as of now I think and CAPEX is, see, it is not a CAPEX intensive business. We have spent on the technology side, and of course, we will have to continue to spend on technology. So, that is all for CAPEX.\n\nSumangal Nevatia: So, the peak of CAPEX will be this intensity only in a particular year or coming years FY’25, '26 you see further increasing CAPEX from what we are spending in FY’24?"", ""|Prateek Kumar:|And your CAPEX this year your CAPEX spend is in the ₹4,200 crores over ₹2,600 crore which we did for last year. So, remaining is only, I guess, around ₹3,000 crores in this segment. So, all of it is expected to get incurred in FY’25 or some of it is like more like working capital related expenditure, so it can come as an operating kind of CAPEX later in the FY’26 or '27?|\n|---|---|\n|Rakshit Hargave:|So, the overall CAPEX spent till 30th June is ₹3,638 crores. That's the right number. So, I think you are having a different number.|\n|Pavan Jain:|We are talking of cumulative. Your cumulative spend on the paint is ₹3,200 crores. ₹3,600 crores. Yes, and ₹4,283 planned for this year, balance of the ₹10,000 crore which is spent in '25. Some small amount may spill over like the performance guarantees like remains etc. That may go to FY’26, but largely, everything will be spent by FY’25.|"", 'Page 6 of 18\n---\n# Grasim Industries Limited\n\nAugust 10, 2023\n\nthat largely it is more or less near is bottoming out. But yes, the trend as for this particular quarter will be lower as compared to the average of last quarter because the exit of last quarter is what we are seeing today as the new stabilization. So, yes, to your question will there be further margin erosion based on the exit of last quarter, it will be relative to, it will be equivalent to that, but from the average of last quarter, it will be a dip.\n\nSumangal Nevatia: Sir, my second question is with respect to CAPEX, for the Paint division, should we expect a large part of our ₹10,000 crore CAPEX to be concluded by FY’25 given that FY’24 also is a very significant CAPEX for the presentation?\n\nPavan Jain: Yes. So, you can assume that. So, a large part of CAPEX will be done by FY’25.']","So, for the Board approved CAPEX numbers, if you look, this is I think one of the highest spending year, current financial year. For the next financial year, we will have while the pending CAPEX of Paints business for the next financial year, we will have proposals to go to the Board and get Board approval etc. So, for next financial year, it is very difficult to say about the numbers, but as of now, yes, this year looks like CAPEX heavy year.",Grasim Industries.pdf
"if we see our ECU realizations in Q1, they have been far better than the other players' reported numbers in the caustic chlorine division. So, just wanted to have your thoughts here that was there any specific reason for our ECU realizations higher than our peers?","The higher ECU realizations in Q1 compared to other players in the caustic chlorine division were primarily due to tactical moves and increased volumes of chlorine derivatives. There was no significant strategic shift involved, but rather a focus on day-to-day active management that contributed to the improved performance.","[""Moderator: Thank you. The next question is from the line of Nirav Jimudia from Anvil Research. Please go ahead.\n\nNirav Jimudia: Sir, I have a few questions. So, one on the chemical side. Sir, if we see our ECU realizations in Q1, they have been far better than the other players' reported numbers in the caustic chlorine division. So, just wanted to have your thoughts here that was there any specific reason for our ECU realizations higher than our peers? If you can share your thoughts here?\n\nJayant Dua: So, I think the reason is that, I think, tactically, we played couple of moves better than some of our competitors. From a long term, if you say, was there any strategic shift? No, I think the difference was that our back, what we call our chlorine derivatives compared to Q4 of last year to Q1 of this year, our volumes have materially gone up. And other than that, it was, I guess, more day-to-day active management.\n\nPage 7 of 18\n---\n# Grasim Industries Limited\n\nAugust 10, 2023"", ""| |We have managed to overcome these headwinds by actually increasing our specialty share, the one that you have mentioned, and we are particularly strong in the wind sector. So, compared to previous quarters, we have improved our specialty margin.|\n| |I don't think we would like to disclose the exact number of the margin, but what I can disclose and confirm what was said earlier by our CFO Mr. Pavan Jain is that our profitability of epoxy has significantly improved. We have doubled over quarter-on-quarter basis, but I would not like to give the exact number of specialty sales and the segment-wise data.|\n|Nirav Jimudia:|You mentioned on a quarter-on-quarter we have doubled our epoxy profit?|\n|Jayant Dhobley:|Yes.|\n|Pavan Jain:|Y-o-Y.|\n|Jayant Dhobley:|Sorry, Y-o-Y basis.|"", ""On the sustainability front, our efforts are well recognized in the industry and value chain. We constantly endeavor to reduce water consumption and emission and increase the share of renewable power. This would be driven by process efficiencies, new technology deployment and investment in renewable power capacities. We have improved our share of renewable power to 11% compared to 8% in last financial year. Additionally, we have been recognized as one of the most sustainable organization by two prestigious media publications, that is The Economic Times and Business World.\n\nNow highlighting some of the key financial parameters of Q1FY'24."", 'The realization also is in the decline trend, and it depends on the pace of decline. Sometimes raw material prices decline faster. Sometime final product prices decline faster depending on the inventory levels, depending on the macro global sales trend etc., etc. So, these are the scenarios currently going through.\n\nOn the Chlor-Alkali side, caustic prices have come down significantly, but helps viscose fibre price, but it again impacts us very badly on the Chlor-Alkali bottom line performance. Energy prices, particularly in terms of coal, have come down recently. That should reflect in our performance in the coming months also, but then it will again depend on how severe is the winter, coming winter, and that will determine the coal prices going forward.']","So, I think the reason is that, I think, tactically, we played couple of moves better than some of our competitors. From a long term, if you say, was there any strategic shift? No, I think the difference was that our back, what we call our chlorine derivatives compared to Q4 of last year to Q1 of this year, our volumes have materially gone up. And other than that, it was, I guess, more day-to-day active management.",Grasim Industries.pdf
what proportion flakes forms in terms of our total sales volumes for caustic soda division?,Flakes form around 20% to 25% of the total sales volumes for the caustic soda division.,"['|Nirav Jimudia:|And sir, what proportion flakes forms in terms of our total sales volumes for caustic soda division?|\n|---|---|\n|Jayant Dua:|So, flakes form to the tune of around 20% to 25% of our total caustic line production.|\n|Nirav Jimudia:|And has that proportion gone up this quarter?|\n|Jayant Dua:|Yes, it has gone up, not significantly. Marginally gone up.|\n|Nirav Jimudia:|Sir, a related question to this, like when we are expanding our caustic soda capacities, does this newer capacities come at a lower power consumption per ton of production? Because what we have seen for a lot of players that when we interacted, they say that it is possible to reduce the per ton consumption of power. So, that and whether it is possible to modify the equipments for the older capacities so that there also there is some scope of power reduction?|', ""|Nirav Jimudia:|Sir, one question on the chemical side. So, if you can share like out of our total caustic sales, is there any proportion of contractual sales into there also? Like out of, let's say, whatever we sell in the domestic market, what is the mix in terms of our contractual and the spot sales?|\n|Jayant Dua:|So, if you look at it, our entire flake sale is spot sales. So, that's straight away about 20%, 22% to 25%, which is totally spot flakes is entirely there. On the caustic side, if you look at it, approximately, I will say our contractual sales would be a larger proportion to the amount of around 60%. On the liquid side, the balance 40% would be a combination of monthly contracts and spot contracts. So, if I were to look at the entire business level, you would say our contract to contractual will be a ratio of 60:40.|\n|Nirav Jimudia:|So, some proportion of higher issue could be because of this contractual arrangements also which…|"", ""Page 4 of 18\n---\n# Grasim Industries Limited\n\nAugust 10, 2023\n\nOur Chlor-Alkali business continues to maintain its market leadership posting volume growth of 5% Y-o-Y at 292,000 metric tons. However, the revenue for the quarter degrew by 21% Y-o-Y to ₹2,146 crore compared to ₹2,733 crore in Q1 last year. The resulting revenue mix from caustic declined from 61% to 55% and chlorine derivatives' revenue increased from 17% to 20% on Y-o-Y basis.\n\nThere remains a sharp focus on developing products around chlorine derivatives, partnership with Lubrizol is in the same direction, whereby the construction of Asia's largest CPVC resin plant at our Vilayat unit is expected to commence this year, and it would help to improve captive consumption of chlorine. Post completion of capacity expansion projects, the chlorine integration would be 72% compared to current 61%."", '|Nirav Jimudia:|So, some proportion of higher issue could be because of this contractual arrangements also which…|\n|Jayant Dua:|So, clearly the flakes and the contactors, some of the long-term contracts are six months. So, they are factored in for the various whatever the market allows you to do that.|\n|Nirav Jimudia:|And sir, last question from my side is on the amount of power what we purchase from the grid because you mentioned that the grid power has become costlier for most of the players in the industry. So, if you can share how much is the power that we purchase from the grid for our total Chemicals division?|']","So, flakes form to the tune of around 20% to 25% of our total caustic line production.",Grasim Industries.pdf
"assuming that there is a further fall or a downslide in India prices, will margins hold at these levels because your pulp prices and caustic prices is going down further or you can see some directionally, some pressure on margins in the coming quarters on VSF?","There may be some pressure on margins in the coming quarters due to the potential further fall in India prices, as well as the downward trend in pulp and caustic prices. However, any impact on margins is expected to be marginal, with small differences likely due to various factors such as raw material prices, inventory levels, and global sales trends.","['My question is that I believe, globally, there has been a further some drop in prices in July and August. So, to that an extent, assuming that there is a further fall or a downslide in India prices, will margins hold at these levels because your pulp prices and caustic prices is going down further or you can see some directionally, some pressure on margins in the coming quarters on VSF?\n\nHarikrishna Agarwal: Yes, you have summed up it almost correctly. So, there will be some pressure, but it is all very marginal. There are not big movements either way. So, yes, prices, the international prices have reduced since end of June, and we also have to follow that trend in India also, and there is some reduction in the raw material prices also, but everything moves. There are so many moving parts, and we have a pipeline in the transit of raw materials and all these things. So, there will be small difference whatever way it is, yes.', ""|Navin Sahadeo:|And just on this margins front, similar to VSF, here also prices, correspond spot prices are lower versus the previous quarter, but I believe cost is also some probably steam left to get that. So, here also should we see margin stabilization or directionally some pressure can come?|\n|Jayant Dua:|The margin profile won't significantly change. Of course, at that point I have to say that when a new factory comes on, we are more likely to increase our share of base and as compared to specialty, so the product mix will change, but the inherent margin profile of the business will not change. We drive our business by spread over raw materials in this particular type of business and sometimes there may be a time lag because of timing of purchase versus timing of sales, but that time lag also rarely exceeds the quarter given the length of our supply chain. So, the margin|"", 'Sumangal Nevatia: So, I mean, as far as the spot rates are concerned for the various cost items, it is already largely reflected in 1Q results when you say there is not much further scope of reduction or there is some further inventory gains and you will see some benefits in the coming quarter?\n\nHarikrishna Agarwal: I think this is fairly reflected already. Yes, small things will keep moving, but that will not be very big.\n\nSumangal Nevatia: And so, the caustic business, sir, given the pressure on prices, coming quarter, should we expect margins also to trend in line with the price weakness or there are some offset available there?\n\nJayant Dua: So, this is Jayant Dua this side. So, we believe that caustic the way it is trending, you are nearly at the end phase of further reduction. There could be marginal changes which are obviously a function of local India movements and how the Indian consumption centre moves, but we believe\n\nPage 6 of 18\n---\n# Grasim Industries Limited\n\nAugust 10, 2023', 'The realization also is in the decline trend, and it depends on the pace of decline. Sometimes raw material prices decline faster. Sometime final product prices decline faster depending on the inventory levels, depending on the macro global sales trend etc., etc. So, these are the scenarios currently going through.\n\nOn the Chlor-Alkali side, caustic prices have come down significantly, but helps viscose fibre price, but it again impacts us very badly on the Chlor-Alkali bottom line performance. Energy prices, particularly in terms of coal, have come down recently. That should reflect in our performance in the coming months also, but then it will again depend on how severe is the winter, coming winter, and that will determine the coal prices going forward.']","Yes, you have summed up it almost correctly. So, there will be some pressure, but it is all very marginal. There are not big movements either way. So, yes, prices, the international prices have reduced since end of June, and we also have to follow that trend in India also, and there is some reduction in the raw material prices also, but everything moves. There are so many moving parts, and we have a pipeline in the transit of raw materials and all these things. So, there will be small difference whatever way it is, yes.",Grasim Industries.pdf
"I mean, give or take few basis points here or there, but these margins are largely bottomed out?","Yes, the margins are largely bottomed out, with the possibility of minor fluctuations.","['Navin Sahadeo: But largely, can we say that this is now the bottom, I mean, give or take few basis points here or there, but these margins are largely bottomed out? Is it a safe thing to say?\n\nHarikrishna Agarwal: We would like to think so. Yes. And you never know. You know, there are always surprises from China or sometimes Europe like the things change so fast. Within one-month things can change. Global sentiments can change. Anything that happens has its effect on everything, but largely, yes, you are right.\n\nNavin Sahadeo: So, just on this, since you mentioned China and the global factors, and recently, there were some news articles about spinning mills like seeing some shutdown or temporary closure in Tamil Nadu or the textile hubs, so does that impact our volume outlook in any way?', ""|Navin Sahadeo:|And just on this margins front, similar to VSF, here also prices, correspond spot prices are lower versus the previous quarter, but I believe cost is also some probably steam left to get that. So, here also should we see margin stabilization or directionally some pressure can come?|\n|Jayant Dua:|The margin profile won't significantly change. Of course, at that point I have to say that when a new factory comes on, we are more likely to increase our share of base and as compared to specialty, so the product mix will change, but the inherent margin profile of the business will not change. We drive our business by spread over raw materials in this particular type of business and sometimes there may be a time lag because of timing of purchase versus timing of sales, but that time lag also rarely exceeds the quarter given the length of our supply chain. So, the margin|"", 'Page 6 of 18\n---\n# Grasim Industries Limited\n\nAugust 10, 2023\n\nthat largely it is more or less near is bottoming out. But yes, the trend as for this particular quarter will be lower as compared to the average of last quarter because the exit of last quarter is what we are seeing today as the new stabilization. So, yes, to your question will there be further margin erosion based on the exit of last quarter, it will be relative to, it will be equivalent to that, but from the average of last quarter, it will be a dip.\n\nSumangal Nevatia: Sir, my second question is with respect to CAPEX, for the Paint division, should we expect a large part of our ₹10,000 crore CAPEX to be concluded by FY’25 given that FY’24 also is a very significant CAPEX for the presentation?\n\nPavan Jain: Yes. So, you can assume that. So, a large part of CAPEX will be done by FY’25.', 'My question is that I believe, globally, there has been a further some drop in prices in July and August. So, to that an extent, assuming that there is a further fall or a downslide in India prices, will margins hold at these levels because your pulp prices and caustic prices is going down further or you can see some directionally, some pressure on margins in the coming quarters on VSF?\n\nHarikrishna Agarwal: Yes, you have summed up it almost correctly. So, there will be some pressure, but it is all very marginal. There are not big movements either way. So, yes, prices, the international prices have reduced since end of June, and we also have to follow that trend in India also, and there is some reduction in the raw material prices also, but everything moves. There are so many moving parts, and we have a pipeline in the transit of raw materials and all these things. So, there will be small difference whatever way it is, yes.']","We would like to think so. Yes. And you never know. You know, there are always surprises from China or sometimes Europe like the things change so fast. Within one-month things can change. Global sentiments can change. Anything that happens has its effect on everything, but largely, yes",Grasim Industries.pdf
"recently, there were some news articles about spinning mills like seeing some shutdown or temporary closure in Tamil Nadu or the textile hubs, so does that impact our volume outlook in any way?",The shutdown or temporary closure of spinning mills in Tamil Nadu or other textile hubs could potentially impact the volume outlook due to the disruption in the textile value chain.,"['Navin Sahadeo: But largely, can we say that this is now the bottom, I mean, give or take few basis points here or there, but these margins are largely bottomed out? Is it a safe thing to say?\n\nHarikrishna Agarwal: We would like to think so. Yes. And you never know. You know, there are always surprises from China or sometimes Europe like the things change so fast. Within one-month things can change. Global sentiments can change. Anything that happens has its effect on everything, but largely, yes, you are right.\n\nNavin Sahadeo: So, just on this, since you mentioned China and the global factors, and recently, there were some news articles about spinning mills like seeing some shutdown or temporary closure in Tamil Nadu or the textile hubs, so does that impact our volume outlook in any way?', ""However, in the near-term, global slowdown has directly impacted India's exports of textiles, which degrew for the 12th consecutive month on Y-o-Y basis. During the June '23 quarter, textile exports are lower by 10% Y-o-Y and 9% Q-o-Q, which has impacted the textile value chain from mills to garment manufacturers. The domestic demand for textiles and apparels is also exhibiting some sluggishness due to delayed festive season, which is in the later part of the year. Cotton prices have also declined 41% Y-o-Y and 4% Q-o-Q which to an extent impacts the demand for viscose as well.\n\nThe Chemical industry is witnessing similar global demand slow down impact, which has resulted in higher inventories. Weak demand from end user industries globally like textiles, packaging materials, constructions etc., especially in the developed countries is indicating subdued scenario in second half of calendar '23."", ""Prateek Kumar: So, because the yarn is getting still more, we are not able to push our product to, fibre product to our yarn customers, and that's why the domestic demand seems weaker now.\n\nHarikrishna Agarwal: Domestic demand is anyway weaker even without this much import, but that import also then dampen on prices of yarn and the profitability of a spinner. And they evaluate which fibre to run, which product is profitable etc., etc.\n\nPrateek Kumar: Other question is on new businesses. So, can you highlight how is the traction in the paint services business which you have started with your, I think, employees or friends and family in the paint segment? How is the initial traction? What exactly we are doing there?"", 'Harikrishna Agarwal: See, globally textile markets are not doing great including in India and not just in viscose, but across all kinds of products, all kind of things, whether it is cotton or polyester or linen or viscose. So, this is a global trend and exports from India have also declined Q-o-Q also and Y-o-Y also. So, everything is under a little bit of slow down.\n\nPage 10 of 18\n---\n# Grasim Industries Limited\n\nAugust 10, 2023']","See, globally textile markets are not doing great including in India and not just in viscose, but across all kinds of products, all kind of things, whether it is cotton or polyester or linen or viscose. So, this is a global trend and exports from India have also declined Q-o-Q also and Y- o-Y also. So, everything is under a little bit of slow down.",Grasim Industries.pdf
"So, there can be some hit on volumes is what you say from the current quarter like we did a pretty healthy utilization of (+90%). So, are we expecting some fall?
",The company is trying its best to maintain volumes and is also looking to increase volume in the export market. They are aiming to maintain volume levels as best as possible.,"[""|Navin Sahadeo:|So, there can be some hit on volumes is what you say from the current quarter like we did a pretty healthy utilization of (+90%). So, are we expecting some fall?|\n|---|---|\n|Harikrishna Agarwal:|Yes, we are trying our best to maintain the volumes and also try to get more volume in export market. So, we try to maintain our volume as best as possible.|\n|Navin Sahadeo:|My second question was then on the chemicals business. Is there a delay in the CAPEX of Chlor-Alkali commissioning? Because I think the capacity increased from 1.3 to 1.5 MTPA, which earlier was guided as Q3 '24. I think the latest presentation says Q1 '25.|\n|Jayant Dua:|So, there is actually, I mean, there is not a significant delay. There is a lot of delay because of the monsoon and all which has been factored in there, but the CAPEX are going as per the plans. These capacities will come by Q1 '25, could be Q4 exit '24, but there has been a fair amount of monsoon delay which has got built into the system.|"", 'Sumangal Nevatia: So, I mean, as far as the spot rates are concerned for the various cost items, it is already largely reflected in 1Q results when you say there is not much further scope of reduction or there is some further inventory gains and you will see some benefits in the coming quarter?\n\nHarikrishna Agarwal: I think this is fairly reflected already. Yes, small things will keep moving, but that will not be very big.\n\nSumangal Nevatia: And so, the caustic business, sir, given the pressure on prices, coming quarter, should we expect margins also to trend in line with the price weakness or there are some offset available there?\n\nJayant Dua: So, this is Jayant Dua this side. So, we believe that caustic the way it is trending, you are nearly at the end phase of further reduction. There could be marginal changes which are obviously a function of local India movements and how the Indian consumption centre moves, but we believe\n\nPage 6 of 18\n---\n# Grasim Industries Limited\n\nAugust 10, 2023', 'Navin Sahadeo: But largely, can we say that this is now the bottom, I mean, give or take few basis points here or there, but these margins are largely bottomed out? Is it a safe thing to say?\n\nHarikrishna Agarwal: We would like to think so. Yes. And you never know. You know, there are always surprises from China or sometimes Europe like the things change so fast. Within one-month things can change. Global sentiments can change. Anything that happens has its effect on everything, but largely, yes, you are right.\n\nNavin Sahadeo: So, just on this, since you mentioned China and the global factors, and recently, there were some news articles about spinning mills like seeing some shutdown or temporary closure in Tamil Nadu or the textile hubs, so does that impact our volume outlook in any way?', 'Page 6 of 18\n---\n# Grasim Industries Limited\n\nAugust 10, 2023\n\nthat largely it is more or less near is bottoming out. But yes, the trend as for this particular quarter will be lower as compared to the average of last quarter because the exit of last quarter is what we are seeing today as the new stabilization. So, yes, to your question will there be further margin erosion based on the exit of last quarter, it will be relative to, it will be equivalent to that, but from the average of last quarter, it will be a dip.\n\nSumangal Nevatia: Sir, my second question is with respect to CAPEX, for the Paint division, should we expect a large part of our ₹10,000 crore CAPEX to be concluded by FY’25 given that FY’24 also is a very significant CAPEX for the presentation?\n\nPavan Jain: Yes. So, you can assume that. So, a large part of CAPEX will be done by FY’25.']","Yes, we are trying our best to maintain the volumes and also try to get more volume in export market. So, we try to maintain our volume as best as possible.",Grasim Industries.pdf
